status,published_at,sequence,title,original_url,tags,local_assets,article_pdf,article_pdf_files,source_dir,notes
source_missing,2015-09-02T00:04:07+09:00,1,雑談。数学の話はしないよ。ブログの目的とか,https://concious4410.hatenablog.com/entry/2015/09/02/000407,雑談,none,none,,,MTエクスポートには公開記事がありますが、対応するローカルTeX・PDFは未登録です。
source_missing,2015-09-13T19:54:26+09:00,2,実数直線上の単射連続関数について,https://concious4410.hatenablog.com/entry/2015/09/13/195426,数学|位相空間|実数に関連する集合論や位相,none,linked,実数直線上の単射連続関数についてDonaDona.pdf,,MTエクスポートには公開記事がありますが、対応するローカルTeX・PDFは未登録です。
source_missing,2015-10-09T20:20:33+09:00,1,距離空間の色々,https://concious4410.hatenablog.com/entry/2015/10/09/202033,位相空間|数学|距離空間,none,linked,距離空間と一様収束とかDona22.pdf,,MTエクスポートには公開記事がありますが、対応するローカルTeX・PDFは未登録です。
source_missing,2015-10-10T21:01:04+09:00,1,閉写像によるコンパクト性の特徴付け,https://concious4410.hatenablog.com/entry/2015/10/10/210104,位相空間|数学|コンパクトネス|僕のお気に入り|固有写像,none,linked,コンパクト性と閉写像と射影beta版.pdf|コンパクト性と射影と閉写像DonaDona2.pdf,,MTエクスポートには公開記事がありますが、対応するローカルTeX・PDFは未登録です。
source_missing,2015-10-19T16:17:10+09:00,1,オイラーの公式と級数の絶対収束性,https://concious4410.hatenablog.com/entry/2015/10/19/161710,雑談|解析|数学,none,none,,,MTエクスポートには公開記事がありますが、対応するローカルTeX・PDFは未登録です。
source_missing,2015-10-31T23:37:10+09:00,1,陰関数定理,https://concious4410.hatenablog.com/entry/2015/10/31/233710,解析|数学|位相空間|多様体論|不動点定理,none,linked,陰関数定理beta版15-10-31.pdf,,MTエクスポートには公開記事がありますが、対応するローカルTeX・PDFは未登録です。
source_missing,2015-12-04T20:41:15+09:00,1,未完成(tube lemma),https://concious4410.hatenablog.com/entry/2015/12/04/204115,位相空間|コンパクトネス|未完成シリーズ,none,linked,TUBElemmaアルファ15-12-04.pdf,,MTエクスポートには公開記事がありますが、対応するローカルTeX・PDFは未登録です。
source_missing,2016-06-20T17:05:05+09:00,1,完全正則空間とか:未完成,https://concious4410.hatenablog.com/entry/2016/06/20/170505,未完成シリーズ|数学|位相空間|完全正則空間,none,linked,完全正則空間A16-06-15.pdf,,MTエクスポートには公開記事がありますが、対応するローカルTeX・PDFは未登録です。
source_missing,2016-07-02T23:56:56+09:00,1,ストーン・ワイエルストラスの定理の話,https://concious4410.hatenablog.com/entry/2016/07/02/235656,雑談|解析|位相空間|実数に関連する集合論や位相|局所コンパクト|コンパクトネス|線形空間,none,none,,,MTエクスポートには公開記事がありますが、対応するローカルTeX・PDFは未登録です。
source_missing,2016-07-06T19:41:38+09:00,1,星型領域はユークリッド空間に微分同相,https://concious4410.hatenablog.com/entry/2016/07/06/194138,位相空間|僕のお気に入り|数学|多様体論|実数に関連する集合論や位相,none,linked,星型領域はユークリッド空間に微分同相Hand16-07-06.pdf,,MTエクスポートには公開記事がありますが、対応するローカルTeX・PDFは未登録です。
source_missing,2016-07-06T22:47:28+09:00,3,LOTS(線形順序位相空間)の正規性,https://concious4410.hatenablog.com/entry/2016/07/06/224728,位相空間|数学|雑談|正規空間|順序数,none,none,,,MTエクスポートには公開記事がありますが、対応するローカルTeX・PDFは未登録です。
source_missing,2016-07-11T16:35:22+09:00,1,Sardの定理にまつわる反例と「多様体の基礎」の誤り,https://concious4410.hatenablog.com/entry/2016/07/11/163522,数学|反例|雑談|多様体論|サードの定理|解析|測度論,none,none,,,MTエクスポートには公開記事がありますが、対応するローカルTeX・PDFは未登録です。
source_missing,2016-07-22T21:07:24+09:00,1,数学の論文の探し方とか,https://concious4410.hatenablog.com/entry/2016/07/22/210724,雑談|数学,none,none,,,MTエクスポートには公開記事がありますが、対応するローカルTeX・PDFは未登録です。
source_missing,2016-08-23T17:33:28+09:00,1,リーマン体積確定集合と太ったカントール集合,https://concious4410.hatenablog.com/entry/2016/08/23/173328,位相空間|解析|雑談|数学|測度論|カントール|実数に関連する集合論や位相,none,none,,,MTエクスポートには公開記事がありますが、対応するローカルTeX・PDFは未登録です。
source_missing,2016-11-13T18:11:03+09:00,1,基本的な0次元距離空間の特徴づけの話,https://concious4410.hatenablog.com/entry/2016/11/13/181103,位相空間|雑談|数学|僕のお気に入り|距離空間,none,none,,,MTエクスポートには公開記事がありますが、対応するローカルTeX・PDFは未登録です。
source_missing,2016-12-09T19:54:26+09:00,1,"""児玉・永見""の参考文献（未完）",https://concious4410.hatenablog.com/entry/2016/12/09/195426,すべて|位相空間|数学,none,none,,,MTエクスポートには公開記事がありますが、対応するローカルTeX・PDFは未登録です。
source_missing,2016-12-16T19:31:28+09:00,1,連結ハウスドルフ可算集合,https://concious4410.hatenablog.com/entry/2016/12/16/193128,雑談|数学|位相空間|連結空間|反例|可算性,none,none,,,MTエクスポートには公開記事がありますが、対応するローカルTeX・PDFは未登録です。
source_missing,2016-12-31T17:36:10+09:00,2,距離空間におけるc.c.c.と可分性の同値性,https://concious4410.hatenablog.com/entry/2016/12/31/173610,数学|距離空間|可算性,none,linked,separatedset16-12-31.pdf,,MTエクスポートには公開記事がありますが、対応するローカルTeX・PDFは未登録です。
source_missing,2017-01-21T20:14:57+09:00,1,多様体の話に出てくる極限集合,https://concious4410.hatenablog.com/entry/2017/01/21/201457,数学|位相空間|多様体論,none,none,,,MTエクスポートには公開記事がありますが、対応するローカルTeX・PDFは未登録です。
source_missing,2017-02-04T21:49:57+09:00,1,宣伝用ツイッターアカウント,https://concious4410.hatenablog.com/entry/2017/02/04/214957,雑談,none,none,,,MTエクスポートには公開記事がありますが、対応するローカルTeX・PDFは未登録です。
source_missing,2017-02-22T15:07:55+09:00,1,このブログ以外の位相のブログ,https://concious4410.hatenablog.com/entry/2017/02/22/150755,雑談,none,none,,,MTエクスポートには公開記事がありますが、対応するローカルTeX・PDFは未登録です。
source_missing,2017-05-17T14:09:29+09:00,1,Sardの定理にまつわる反例その２,https://concious4410.hatenablog.com/entry/2017/05/17/140929,数学|反例|多様体論|サードの定理,none,none,,,MTエクスポートには公開記事がありますが、対応するローカルTeX・PDFは未登録です。
source_missing,2024-07-21T10:03:48+09:00,1,ユークリッド空間内の星型領域はその全体に微分同相である．,https://concious4410.hatenablog.com/entry/2024/07/21/100348,距離空間|数学|多様体論,none,linked,StarDiffeo.pdf,,MTエクスポートには公開記事がありますが、対応するローカルTeX・PDFは未登録です。
source_missing,2024-12-01T21:39:48+09:00,1,クラークソンの不等式(未完成),https://concious4410.hatenablog.com/entry/2024/12/01/213948,複素解析|解析|線形空間,none,linked,clakson.pdf,,MTエクスポートには公開記事がありますが、対応するローカルTeX・PDFは未登録です。
source_missing,2026-03-09T14:59:33+09:00,1,族正規と写像の拡張,https://concious4410.hatenablog.com/entry/2026/03/09/145933,ウリゾーン|正規空間|距離空間|数学|位相空間,none,linked,collnor.pdf,,MTエクスポートには公開記事がありますが、対応するローカルTeX・PDFは未登録です。
source_missing,2026-03-11T11:24:26+09:00,1,完全写像をpullbackで記述する，圏を知らぬ私が．,https://concious4410.hatenablog.com/entry/2026/03/11/112426,コンパクトネス|完全正則空間|固有写像|位相空間|数学|断片ではないもの,none,linked,permap.pdf,,MTエクスポートには公開記事がありますが、対応するローカルTeX・PDFは未登録です。
source_missing,2026-03-18T18:12:05+09:00,1,バナッハ・ストーンの定理: おまけ,https://concious4410.hatenablog.com/entry/2026/03/18/181205,関数解析|数学|線形空間|完全正則空間|位相空間|コンパクトネス,none,linked,banachstone.pdf,,MTエクスポートには公開記事がありますが、対応するローカルTeX・PDFは未登録です。
source_missing,2026-03-23T11:04:16+09:00,1,クレイン・ミルマンの定理：関数解析その0,https://concious4410.hatenablog.com/entry/2026/03/23/110416,コンパクトネス|位相空間|測度論|線形空間|関数解析|数学,none,linked,kreinmilman.pdf,,MTエクスポートには公開記事がありますが、対応するローカルTeX・PDFは未登録です。
source_missing,2026-03-26T15:47:13+09:00,1,Goursat's lemma,https://concious4410.hatenablog.com/entry/2026/03/26/154713,代数|数学,none,linked,Grousat.pdf,,MTエクスポートには公開記事がありますが、対応するローカルTeX・PDFは未登録です。
source_missing,2026-04-05T18:14:41+09:00,1,不動点定理と同値な命題,https://concious4410.hatenablog.com/entry/2026/04/05/181441,不動点定理|代数的トポロジー|位相空間|数学|次元論,none,linked,fixedpp.pdf,,MTエクスポートには公開記事がありますが、対応するローカルTeX・PDFは未登録です。
source_missing,2026-04-15T22:05:50+09:00,1,次元論からの領域不変性定理の証明,https://concious4410.hatenablog.com/entry/2026/04/15/220550,不動点定理|代数的トポロジー|位相空間|多様体論|実数に関連する集合論や位相|数学|次元論|距離空間,none,linked,jigenndayo1.pdf,,MTエクスポートには公開記事がありますが、対応するローカルTeX・PDFは未登録です。
source_missing,2026-04-17T17:29:19+09:00,1,善良超フィルターの存在証明,https://concious4410.hatenablog.com/entry/2026/04/17/172919,数学|順序数,none,linked,ultrafiltergood.pdf,,MTエクスポートには公開記事がありますが、対応するローカルTeX・PDFは未登録です。
source_missing,2026-06-09T18:06:58+09:00,1,Limitation topologyとBing's shrinking criterion,https://concious4410.hatenablog.com/entry/2026/06/09/180658,パラコンパクトネス|位相空間|固有写像|数学|未完成シリーズ|距離化可能定理|商空間,none,linked,funcspbairefine111.pdf,,MTエクスポートには公開記事がありますが、対応するローカルTeX・PDFは未登録です。
source_missing,2026-06-27T19:39:49+09:00,1,正規空間の被覆次元,https://concious4410.hatenablog.com/entry/2026/06/27/193949,ウリゾーン|代数的トポロジー|位相空間|数学|次元論|正規空間,none,linked,covdimdayon.pdf,,MTエクスポートには公開記事がありますが、対応するローカルTeX・PDFは未登録です。
source_missing,2026-06-28T19:10:17+09:00,1,被覆次元と埋め込み,https://concious4410.hatenablog.com/entry/2026/06/28/191017,ベール空間|位相空間|数学|次元論|可算性,none,linked,dimembeddayo.pdf,,MTエクスポートには公開記事がありますが、対応するローカルTeX・PDFは未登録です。
source_missing,2026-07-02T16:14:09+09:00,1,可分距離化可能空間における次元論,https://concious4410.hatenablog.com/entry/2026/07/02/161409,ウリゾーン|コンパクトネス|パラコンパクトネス|不動点定理|代数的トポロジー|位相空間|僕のお気に入り|多様体論|局所コンパクト|数学|次元論|正規空間|断片ではないもの,none,linked,dimtheoryblog.pdf,,MTエクスポートには公開記事がありますが、対応するローカルTeX・PDFは未登録です。
