status,published_at,sequence,title,original_url,tags,local_assets,article_pdf,article_pdf_files,source_dir,notes
source_missing,2015-09-13T19:54:26+09:00,2,実数直線上の単射連続関数について,https://concious4410.hatenablog.com/entry/2015/09/13/195426,数学|位相空間|実数に関連する集合論や位相,none,linked,実数直線上の単射連続関数についてDonaDona.pdf,,MTエクスポートには公開記事がありますが、対応するローカルTeX・PDFは未登録です。
source_missing,2015-10-09T20:20:33+09:00,1,距離空間の色々,https://concious4410.hatenablog.com/entry/2015/10/09/202033,位相空間|数学|距離空間,none,linked,距離空間と一様収束とかDona22.pdf,,MTエクスポートには公開記事がありますが、対応するローカルTeX・PDFは未登録です。
source_missing,2015-10-10T21:01:04+09:00,1,閉写像によるコンパクト性の特徴付け,https://concious4410.hatenablog.com/entry/2015/10/10/210104,位相空間|数学|コンパクトネス|僕のお気に入り|固有写像,none,linked,コンパクト性と閉写像と射影beta版.pdf|コンパクト性と射影と閉写像DonaDona2.pdf,,MTエクスポートには公開記事がありますが、対応するローカルTeX・PDFは未登録です。
source_missing,2015-10-31T23:37:10+09:00,1,陰関数定理,https://concious4410.hatenablog.com/entry/2015/10/31/233710,解析|数学|位相空間|多様体論|不動点定理,none,linked,陰関数定理beta版15-10-31.pdf,,MTエクスポートには公開記事がありますが、対応するローカルTeX・PDFは未登録です。
source_missing,2015-12-04T20:41:15+09:00,1,未完成(tube lemma),https://concious4410.hatenablog.com/entry/2015/12/04/204115,位相空間|コンパクトネス|未完成シリーズ,none,linked,TUBElemmaアルファ15-12-04.pdf,,MTエクスポートには公開記事がありますが、対応するローカルTeX・PDFは未登録です。
source_missing,2016-06-20T17:05:05+09:00,1,完全正則空間とか:未完成,https://concious4410.hatenablog.com/entry/2016/06/20/170505,未完成シリーズ|数学|位相空間|完全正則空間,none,linked,完全正則空間A16-06-15.pdf,,MTエクスポートには公開記事がありますが、対応するローカルTeX・PDFは未登録です。
source_missing,2016-12-31T17:36:10+09:00,2,距離空間におけるc.c.c.と可分性の同値性,https://concious4410.hatenablog.com/entry/2016/12/31/173610,数学|距離空間|可算性,none,linked,separatedset16-12-31.pdf,,MTエクスポートには公開記事がありますが、対応するローカルTeX・PDFは未登録です。
source_missing,2026-07-02T16:14:09+09:00,1,可分距離化可能空間における次元論,https://concious4410.hatenablog.com/entry/2026/07/02/161409,ウリゾーン|コンパクトネス|パラコンパクトネス|不動点定理|代数的トポロジー|位相空間|僕のお気に入り|多様体論|局所コンパクト|数学|次元論|正規空間|断片ではないもの,none,linked,dimtheoryblog.pdf,,MTエクスポートには公開記事がありますが、対応するローカルTeX・PDFは未登録です。
